text,author,score,datetime
"Guess how far my 2006 Vauxhall Astra 1.6 petrol car will take you on a full tank of petrol?? Answer is the same distance as when I bought it in 2006!! Easily from Manchester to Devon on holiday 243 miles with a third of a tank left. Second hand milk floats are a joke 😅 why would you even consider buying one. You have just proved what we all knew will happen. So in a few more years your 59 mile range will be so low you would be lucky to get off the drive especially if its raining, dark or freezing cold and you put the heater on😅😅😅",@robertwhite361,1,2024-04-18T01:18:45Z
"I mean I couldn't get to my nearest city and back but totally for people only doing 5 mins to the shops. I might buy one at 1500 to convert into a sidexside atv, can you get 4x4 versions.",@robabob1001,0,2024-04-18T00:43:00Z
Locking wheel nuts? Why bother on 16 inch allow wheels? LOL,@Chris-ew9mh,0,2024-04-18T00:27:51Z
So a used electric car is basically trash metal?!,@movsar93mn,1,2024-04-18T00:17:09Z
"Like at the beginning of the video, ive found the EV's use a tremendous amount of energy while in Park compared to an ICE that is in ESS. Even with the HVAC off. I dont understand where this energy is going. It's ~650W  of draw baseline. For the radio and IPC lights?",@Blake-qz2rg,0,2024-04-18T00:09:53Z
"Good thing the batteries can be easily recycled. Oh, wait…",@arisaga822,0,2024-04-17T23:34:00Z
"My mother bought one new in 2012 for $45k. It averaged about 75 miles, she traded it in for a second Gen that gets about 250 miles. The car has 10k miles on the clock and they gave her $5k for it. EVs are even worse investments than gas cars.",@sanmanFS2K,0,2024-04-17T23:26:07Z
Hybrid is the future.. not full EV,@xotic8617,0,2024-04-17T23:15:29Z
So the car’s estimate at the beginning was pretty much spot on - it said 59 and you got 60.,@andrewmole745,120,2024-04-17T21:59:26Z
the leaf is notorious for battery degredation,@tonypegler9080,0,2024-04-17T21:57:38Z
No thanks I will stick with my self charging Toyota Hybrid.,@alanhowemusic2457,0,2024-04-17T21:33:58Z
"ah yes, the perfect solution to environmental problems, creating more waste and environmental destruction. brilliant!",@lbochtler,0,2024-04-17T21:23:03Z
Never in a million years I prefer walking,@JohnSmith-lc6gq,0,2024-04-17T20:56:02Z
Great video! Matt from cleevely EV here https://www.youtube.com/live/LQoIh_-lf3Q?si=KwUWf4Nn7SgLk2xs,@chargeheadsuk,0,2024-04-17T20:50:41Z
При установке правильных шин данный результат можно прилично улучшить,@user-cb2nf9qs5z,0,2024-04-17T20:47:00Z
Take all your points about a local runabout and at least it was made in the UK. Still don't like the principle of battery cars and the brainwashing behind them. Liked the vid. and good to see my old firm rescuing you.,@RichardASK,0,2024-04-17T20:29:26Z
"Heck, even a cheap gas-powered motorcycle beat that crap EV car!",@oculosprudentium8486,0,2024-04-17T20:12:41Z
"The car's original price was 24,000 pounds AFTER government subsidies, which means the actual cost of the car was about 30,000. And now you can buy it for 1,500. That is a 95% loss in resale value. CRAZY!",@LaVidayElTristeFinal,460,2024-04-17T20:03:18Z
"Imagine that the gas tank of your car would shrink every day from day one, getting smaller and smaller, until it has no capacity for gasoline. This is what having an EV is like. I don't get why anybody would buy these things.",@LaVidayElTristeFinal,19,2024-04-17T19:55:59Z
Not for me still considering I just paid off my ICE vehicle I intend to get my use out of it first and hopefully by that time EVs will be much safer and better built with an infrastructure in place everywhere I'd potentially need it.,@lunarvvolf9606,0,2024-04-17T19:48:17Z
"on one hand, I love how this guy pronounces ""bad-ter-ee""! on the other, he starts by making a big deal about the BADTERY DOESN'T HAVE THE RANGE OF A NEW ONE!!! THE WORLD IS ENDING. HIDE YOUR WIFE HIDE YOUR KIDS, THEY""RE COMING FOR YOU!!!",@squirlmy,0,2024-04-17T19:40:31Z
How many rounds of toast does it do on half a charge?,@marknorris5269,0,2024-04-17T19:15:31Z
This video just reiterates that we aren’t ready for cheap/crappy electric cars for people without the means to buy newer.,@CLINT-THE-GREAT,0,2024-04-17T18:39:33Z
Delusional to think it doesn't need maintenance. If something fails in electric toy cars it's insanely expensive to fix.,@antoniohagopian213,9,2024-04-17T18:39:21Z
"2013 Nissan Leaf had an EPA range of 84 miles in the US, how did NEDC come up with 124?
I had a 2014 for 5 years, great car but 84 miles was in ideal situations and the computer never told me over 100.",@user-ve7nq9kj7l,0,2024-04-17T18:37:50Z
What can go wring?  Every electrical system or mechanical system can go wrong.,@kingklr1,0,2024-04-17T18:10:44Z
"Nice video, very informative.  Thanks!",@lawrencerubanka7087,0,2024-04-17T18:05:18Z
I find it amusing they are talking full charge 50 miles my 18 yr old car cost 800 quid and i can do 500 miles on a full tank,@robertwilkinson2232,0,2024-04-17T17:38:16Z
lol the reality on why if you like going out for a long drive that electric cars are useless even when they finaly get electric out puts everywhere  they can  you still got the eventuality of having to wait several hours whilst it charges,@doc140bullseye,0,2024-04-17T17:35:10Z
"That's what I call a review. Nice work, gents.",@salassian3162,0,2024-04-17T17:35:07Z
"You should not put the meter at miles or Km but % battery left.  Much more precise.  At 15% you start thinking about it, at 10% you look for a charger and at 5% you stop on the side and make a plan…😂",@flipper3691,0,2024-04-17T17:29:14Z
"A friend, a woman, bought a Leaf a couple of years ago.  From a dealer.  It would only go about 47 miles before dying.  Recharge, 47 miles and so on.  Tried to return it, they laughed.  Had to give it away.  Loss?  $11,000.
Anyone who buys an EV deserves what they get.",@mutteringmale,0,2024-04-17T17:27:57Z
Ev are old outdated technology with the introduction of hydrogen ammonia and even H2o engines who would buy a ev,@ianforrest6728,0,2024-04-17T17:22:38Z
Sucks if you live 30 miles away from your job and there’s no charging port there,@pomosstream3202,0,2024-04-17T17:17:10Z
"You haul around about 1000 lbs. of battery to go a whopping 60mi. If you are very careful to drive like an old blind lady. In a gasoline car I haul around 108 lbs of fuel at the start and can go 324 mi. @ 70 mph. That little electric car puts out 0 carbon emissions. But where did the electricity to re-charge that heavy battery come from? Nuclear plants, they are nice and clean with waste that is deadly for millions of years. Coal or gas power plants. They are nice and clean since the CO2 isn't released near you. How about those wonderful wind turbines, which don't return as much energy as the fossil fuel required to build them? Then of course there is the 20% energy loss in high tension power lines to consider. And of course the fact that the little car moves 1000 lbs. of battery ever time it moves. Yep electric is the way to go.",@nearlynormal2293,0,2024-04-17T17:11:37Z
"With every car I ever owned, I always exceeded 44 000 miles in about 4 years. To me, buying a car that is useless within after 44 000 miles, is ... Crazy!",@rasmuswittsell10,8,2024-04-17T17:09:13Z
Just avoid all the gen 1 EVs and the gen 2 Leafs and you’ll be fine.,@thomasandrews7727,0,2024-04-17T17:08:48Z
"clean 10 yr old with 44k miles for 1,500 pounds is a good deal. You must assume that the need for a new battery is part of that.",@ronald4life1,0,2024-04-17T16:52:47Z
"I actually still prefer my old 1.9TDI
the car is cheap, the parts are cheap, and the diesel related parts and transmission basically never break down, and if they do, they are dirt cheap

you can get a 5 speed transmission with a complete engine and accessories for about 300, maybe even for free if you know a guy
over 315.000km and still going strong",@nathanwest2304,0,2024-04-17T16:49:14Z
"He sounds more like a salesman then a reviewer. The interior is crap, he doesn't mention the insurance costs, which are more then the car. There's a que for the charger, tires where twice as fast do to the weight.  You can only realistically go 10 miles there and 10 miles back.",@Number6_,0,2024-04-17T16:48:56Z
Absolute rubbish! This car is not fit for purpose. You Evangelists are delusional. These things are like mobile phones disposable.,@pindiddle,0,2024-04-17T16:33:43Z
"24 kWh (usable 22 kWh), new 124 Miles?",@frank40m999,0,2024-04-17T16:31:01Z
"Matt meets Matt
Brilliant stuff 😊",@PJWey,0,2024-04-17T16:29:33Z
All these people buys EV‘s probably never own a remote control car before they did. They know electric vehicles suck.,@davidjohanson9997,0,2024-04-17T16:23:28Z
"70% after 11 years is decent for first gen electric car batteries.
Modern water cooled batteries with better BMS' will probably leave those cars at 80% after 11 years. That's still really great!",@ToreOnYouTube,1,2024-04-17T16:18:50Z
"When batteries go bad, they REALLY go bad!",@ToreOnYouTube,0,2024-04-17T16:07:35Z
I think the mold is probably from the car ignoring its personal hygiene.  Ignoring hygiene is a pretty common outwardly visible symptom of depression.  I think the car is probably suffering some serious depression and low self esteem secondary to the fact that it is a Nissan.  So on top of the short range and the purchase price  and possible lease of a battery you may need to purchase car therapy and anti-depressant medication. Plus once you are driving a Nissan Leaf chances are you may need anti depression meds.  It seems like a lot of expense to me but I also think All Cars Are Valuable (ACAV) so tough call.,@williamwelborn4555,0,2024-04-17T16:03:21Z
You rolled your window up?!?  You wasted so much range!  No wonder you didn't make it.,@PruneHub,0,2024-04-17T15:55:04Z
An EV is not a car to me. It's a mode of transport for getting from A to B. Yuk!,@club1fan552,0,2024-04-17T15:43:11Z
"ah- when this POS was new, it had a range of, about, 70 miles.  Nissan lies, we all know that.",@cj90014,0,2024-04-17T15:05:07Z
Ev are useless no go items. 3 years old they are worthless. Mine was£120000 new 3 years on  48000 on the clock only worth £38000 and nobody what’s it not even Porsche want it on trade in .,@paulnewman1814,0,2024-04-17T14:55:06Z
"Max range videos demonstrate that the video maker doesn't grasp the paradigm shift of electric cars. 
When deciding to buy an EV, like any vehicle, the buyer must realistically figure out what he/she needs. In my case I had a 34 mile round trip commute. An EV with 80 miles of range was perfect since it would get me to work and back without damaging the battery by draining it too low. I plugged in when I got home and every morning the car was fully charged again.
A person would only buy a ten year old Leaf with 60 miles of range if they wanted a commuter car or grocery-getter. Running the d@mn thing dry is senseless.",@331SVTCobra,0,2024-04-17T14:48:52Z
60 mile range. No thanks. My VW Sharon gives me 600+ miles on a full tank of diesel.,@craigbanks9532,1,2024-04-17T14:40:06Z
"Some extremely useful info regarding batteries: 

There are 3 main different battery technologies that were at some point or another used in EVs. 
Li-Ion, Li-Po, LiFePo4. 
The market right now is almost if not completely exclusively using Li-Ion batteries due to their small size and light weight. 
Basically Li-Po are the lightest and smallest, but also have the worst charge cycle count (how many times you can charge the battery 0-100% before it is considered ""bad""). 
LiFePo4 have by far the superior charge cycle count, but are quite bigger and heavier. 

So the happy middle ground is Li-Ion. Many times used in this 18650 or 21700 cell form factor. 

That Nissan Leaf, might have been using Li-Po batteries just by seeing those pouches and how they got swollen. Generally you can expect up to 100-300 cycles out of a Li-Po, 300-1000 out of a Li-Ion and 1500-6000 out of a LiFePo4 battery. 

What is a charge cycle really? 
In theory it is the sum of the partial charge cycles (for example 40-100, 15-100, 50-100, 95-100, these four charges would be 2 full charge cycles, because they sum at 200% of charge need). But that's not the whole story. A battery is happier if it's SoC (state of charge) doesn't fall below 20%. Most importantly it's way happier if it doesn't stay below 20% for extended periods of time (not charging it for a day or two...). It's also happy if it doesn't stay at 100% for extended periods of time. So, if you make sure that the battery isn't close to those extremes, you can extend these charge cycles quite considerably. 
So, for example a Tesla battery of the last year, should have some Li-Ion cells capable of 1000 charge cycles (impressively high for Li-Ion, best on the market). If tesla engineers make sure their reported SoC is slightly different to the real SoC of the battery, making sure to stay away from those extremes, the battery can last up to 3500 smaller charge cycles (25-90%), which is up to 2500 full charge cycles instead of just 1000... 

3500 charge cycles is roughly 10 years somebody might say. And that's pretty much the case if someone totally drains their car daily. However,I don't believe tesla puts so relaxed extremes to their batteries (because they would lose advertised range that way...), so I think it's more like 2000 cycles of 10-90%. 
Roughly 6 years for daily draining. 
Realistically you will use all the battery every 2-3 days if you drive a lot, so... 12-16 years? Something like that. 

Is charge cycle count the only consideration when talking about battery life? 
No... 

Battery ageing occurs no matter what, it's just faster if the battery is empty or full. 

For a Li-Ion battery you can expect 10-15 years of battery life no matter how much you take care of it. 

So. What does it mean for a battery to die? 

In the world of Lithium batteries, a dead battery is a battery that is below 80% if its original capacity. Why is that? 
Basically from 100% to 80% the battery again curve is a straight line, slowly going down in a straight line as the years or the charge cycles pass. 
However at 80% of its original capacity, this straight line becomes a more and more aggressive curve. 

That actually means that after that 80% point, the ageing of the cells occurs faster and faster and faster. You might need 10 years to go to 80%, but you will need 5 years to go to 60%. 2 years to go to 40%. 1 year to go to 10%. 
That's just an example, but these numbers are almost accurate. 

So basically, your battery is still ok at 85%. At 80% starts the downhill and nothing can stop it. 

So, what does that mean for the Nissan Leaf? First of all, the car already has a kind of bad battery technology if they were using Li-Po cells. So, I assume the 100-80% window closed at around 8 years of use at best. Secondly, the battery that now is at 65-70% is considered dead. You can expect month by month to see a slight reduction in mileage. In the next ~2-4 years, the battery will completely die, unable to do much of anything. 
Are 1500£ worth it? Meh... Idk... The car works and it's electric... It might not pay itself because there are too few charge cycles remaining...  I mean, for 1500£, you get an electric scooter with less range, so... Yeah. It is kind of value for money... I might would have bought this or something similiral and try to fit my own batteries somehow 😃 
That would give me 15 full years of way better range... They only bad thing is that these things have lots of factory locks and stuff... I'd really love to be able to put my own batteries on any of the EVs... Imagine having a second full battery in the trunk... Imagine doing that on a new car. 1000km of range. 

Anyways. These were some nice info for Lithium batteries.",@FishFish1995,4,2024-04-17T14:10:58Z
Videos like this are so interesting. More please!,@svlagonda7417,0,2024-04-17T14:10:10Z
Come on matt u getting back handers my dads ev has had loads of problems  and they stay in garage  a long time,@chrishickmott7806,0,2024-04-17T13:42:03Z
"Miles is a guy in the Simpson, not a unit of measure",@niolss,0,2024-04-17T13:38:19Z
They had to use the pathetic Nissan leaf as the example.vAlmost 15 year old technology as an example of why used EV''S are a scam. The argument is ridiculous. I would take a used Tesla if I could afford one. The battery may very well Outlast me.,@tonystorcke,0,2024-04-17T13:28:24Z
"The issue here is that a 2014 (2013?) car has a 2011-era battery. A very different thing than the 2019-2024 era batteries in 2023-2024 BEVs, today. There just aren’t very many 10 year-old BEVs around (first: there never were many, second: vehicles from the nascent EV-era developed MANY problems that took them off the road). It was a good article on verrry-early,short-range (even when new) vehicles. I wouldn’t buy an EV that is more than three years old, though.",@BeachriderUSA,0,2024-04-17T13:12:57Z
"Am loving how EV sales - new ones, at least - are plummeting. They are a solution looking for a problem. The next miss-selling scandal ?",@rjw4762,1,2024-04-17T13:07:28Z
A milk float would have been better?,@alanjane4605,0,2024-04-17T13:05:44Z
They should call this the bullshit Car -,@chrissanders8362,0,2024-04-17T12:58:57Z
What's the cost of replacing the battery?,@svlagonda7417,0,2024-04-17T12:56:44Z
Worth reading Miles Brignall in The Guardian about the problems associated with the Renault Zoe. Many franchised dealers can't/won't fix them and common problems run up bills of £000s.,@richardsimpson3792,0,2024-04-17T12:56:24Z
Of course used EVs are a rip-off- brand new ones are too!,@DM-it2ch,1,2024-04-17T12:52:51Z
"Early Nissan Leaf which didn't have thermal management of the battery in Battery Degradation Shocker! 🙄

Newer battery technologies with proper management are unlikely to even get as low as 70% SOH after 11 years ... 80+% is more probable.",@InBodWeTrust,0,2024-04-17T12:49:01Z
"hmmm.. just looked on Carwow the cheapest leaf on there today is 9,900. Auto trader has one that looks identical to the one in this vid for 3,500. Similar mileage, same year.",@selseyonetwenty4631,0,2024-04-17T12:48:18Z
You'll still be fine in that 15 minute city.,@jonathanparle8429,2,2024-04-17T12:36:13Z
"Degradation in the battery is exponential, though. It'll only get worse, and it'll get worse faster with more use.
Also, charging a degraded battery requires more energy and you're paying for the KwH you put into it... not the KwH it manages to retain.",@gdutfulkbhh7537,0,2024-04-17T12:30:45Z
"Several errors in this review. It's a shame that the commentary is so sensationalist, rather than giving a balanced view based on some experience of the car.",@erbster200,0,2024-04-17T12:27:45Z
Errrr under no circumstance is it a win for a Nissan …..,@kola100,0,2024-04-17T12:23:16Z
Nice video.  You guys are far ahead of Canada in this stuff.,@BlueAlgon,0,2024-04-17T12:21:30Z
Dude shills cars that lose more in value in depreciation over a month than he did for that scrappy EV :D,@dallysinghson5569,0,2024-04-17T12:08:36Z
"LOL. Only complete dickwagons buy EVs. New or used is irrelevant, they're all JUNK right from the factory.",@wombatdk,0,2024-04-17T11:53:37Z
Current battery tech is bad. Maybe if solid state batteries become a reality i will take it seriously.,@redditsucksyo,0,2024-04-17T11:50:41Z
"they sell those here at 7-8000eur hilarious, Mercedes EV that was from 2015 or something, it´s impossible to buy new front light... or motor if it stop´s working joke.",@WFKO.,0,2024-04-17T11:48:21Z
"What car guy doesnt know about regenerative breaking on EV's?

EDIT: Oh, on minute 8 he figured it out. smh",@incognito3402,0,2024-04-17T11:42:55Z
Here in oz we prefer hybrid not plug in hybrid but just hybrid suits range for country or city.,@phillipkrelle5661,0,2024-04-17T11:39:01Z
"$5,000 of government grant is a euphemism for $5,000 stolen from your fellow citizens to pay for something they don't want.",@BuFFoTheArtClown,0,2024-04-17T11:27:48Z
"Now that Nissan left its customers hand dry without mobile phone app, I would reconsider ever buying a car from them, used or new.",@null090909,0,2024-04-17T11:22:35Z
"According to another Brit YouTuber, EVs in general are a rip-off. Why would a used EV be any different?",@billmullins6833,1,2024-04-17T11:05:47Z
"A 2013 Leaf is a steal for that money. It's a great car and with an electric motor the maintenance is close to nothing, along with the fuel costs. How many times a week do you drive more than 50 miles/90km in a day? Our Leaf is our second car and still gets the job done admirably, even with this low range.

The reason the mileage was changing so much is that it was calibrating the real world usage. It doesn't usually shift around that much, but it can change quite a lot when you swap from surface roads to freeway driving and so on.",@colinjacobs176,0,2024-04-17T11:04:15Z
"The leaf was the first EV sold in the EU, I believe? It's a smaller battery (that degrades quicker) and also has multiple companies that replace the battery by a bigger range on and other options. So hmm… 1) this is in no way realistic to what happens when the current EVs are 10 years old  2) Even for 1500 it's a good car if you can service the battery for the same amount.  3) Shortest amount of miles… also for EVs, accelerating and changing speeds costs more than just cruisin'. So the longer route, but a constant speed on a long simple road, would be better than going along every roundabout in the neighbourhood.",@jorismak,0,2024-04-17T11:03:50Z
"Okay so what the battery guy is actually saying is that if you’re battery is fried, your car is an economic “total loss”. Yeah so we need battery health reports to become obligatory and certified on second hand electric cars.",@yml84,0,2024-04-17T11:03:40Z
90% of EVs made are still on the road. The other 10% got home.,@PanglossDr,1,2024-04-17T11:02:46Z
Yes.. . Even with a very average battery a cheap EV is a life changer for those that can't afford much. The lack of maintenance cost can help fund other life necessities and have far less stress about reliability etc.,@carylittleford8980,0,2024-04-17T10:58:21Z
"I've just noticed that when ever you mention EV's, EV lovers / owners will always tell you how it's changed their lives, cost nothing to live with and will try sell you it / give it a review much like a phone / tv / fridge etc.",@penguinactually,1,2024-04-17T10:57:49Z
I wonder what the insurance cost is on this car?,@polyphonics557,0,2024-04-17T10:57:45Z
I read that electric cars cannot be towed and must go on the actual breakdown lorry. If they towed it wouldn’t it wreck the motor?,@ljb9983,0,2024-04-17T10:42:00Z
"I get your point with reliability, but anyone who works in tech knows you are introducing more things to go wrong, not less. 
You see videos of people getting cars from 1950s working, you won’t find videos 70 years from now of people getting these cars going.",@CozzyB,0,2024-04-17T10:35:10Z
"Who in their right mind uses builtin navigational software? Its crap, its clunky, if anything - THOSE are a ripoff.",@rubbelkatz3672,0,2024-04-17T10:32:59Z
It shows how low our expectations have become when 60 mile range for 1500+ new battery cell for 2000 is a good deal!,@w201carb2,4,2024-04-17T10:32:17Z
This video was way too kind a favourable to used first gen Nissan Leafs. They are useless to most people and are not even worth the £4-6k asking price that they usually go for. Also the battery chemistry in early Leafs was bad and it wasn't actively cooled either. Stay away.,@Reprogrammed_By_SEGA,5,2024-04-17T10:29:22Z
"Shows how crazy pro ev advice is!  How can you say that’s a win??! Haha. When a car that has 60 mile range and costs 1500£. Lost most of its value in 10 years.  Look at comparable ICE cars for 1500£, without any range anxiety, retain their value.  And yes, are better for the environment.  Yes ok if you can have 2 cars, it may be ok for school run but that’s hardly a green option is it? Your still running another car but can virtue signal outside the school gates!! Haha. Look at some of the higher end evs 75% depreciation in 2 years. But still not a bargain, just s liability !",@w201carb2,1,2024-04-17T10:24:04Z
Carwow please gift me this car..,@kazoorabryans5168,0,2024-04-17T10:19:40Z
"I just started the video and I am not sure how many times I can withstand this man saying the word ""bah-tree""",@walpoly,1,2024-04-17T10:15:04Z
"Congratulations on your new used giant damp electric uterus, Mat 😂",@themindset3329,1,2024-04-17T10:05:23Z
Not much to go wrong...other than the Battery pack continuing to degrade and ultimately fail totally requiring you to spend MORE than what you originally paid for the vehicle to replace the battery...good thinking Holmes!,@grantmckinnon2300,1,2024-04-17T10:05:15Z
"This video is worth its weight in gold purely because it has no-nonsense answers to the questions I had about buying an old EV. Now I'm informed, and based on this I would probably buy an EV as runabout to get to and from work. Nice one mate.",@DandamanV,0,2024-04-17T10:03:24Z
well known that early Leafs had problems with their batteries - you knew that when you bought it so don't try to make out EVs are crap - it's your research is crap,@psychotron9,0,2024-04-17T09:31:33Z
"Definitely not, like it might not be that high tech however its definitely reliable",@user-zabideen1102,0,2024-04-17T09:26:07Z
Meanwhile ICE cars lasting 100 years......,@darksade2000,2,2024-04-17T09:16:33Z
