text,author,score,datetime
"So much cope in this video 🤣
Look, if you are someone with a privately owned residence, have access to home charging and do very limited miles then yes I see the point. Limiting someone to 60 miles range, well really 50-55 as nobody will run to literal empty before charging, is still fairly poor. Because that means if you need to travel more than 25 miles away from your home you WILL need to stop and use a public charger. Wintery day it will be slightly less again. I just find that completely unacceptable considering you can get about 33-39mpg from a 1.6 petrol (around that £1500 mark) which is about 366-432 miles to empty on 50l. Even take 30 miles off that, nobody runs til you run out, you are still at worst 336 miles from full. My old 06' 1.9TDI PD Golf got 42-46mpg driving around suburbs (33-35mpg from cold and very short journeys), overall you'll get 450-500 miles to a tank.

I'm not hating on EVs, they suit very low mileage and people who have access to home charging. Whereas the internal combustion engine has a huge range of applications to suit the needs of the driver. Will technology improve? Of course, nobody is denying that improvements are being made. I fully believe in Hydrogen is the way forward for convenience and range, but again it has a long way to go. 

My final issue (not really relevant to this video) is new car prices are simply unattainable for the average working class family. Nearly every car manufacture is ""going upmarket"" and filling cars with ludicrous amounts of tech. Example, 10 years ago a baseline Skoda Fabia 1.2 petrol had an OTR of £9995. Today, a 2024 baseline Fabia stands at £19730, that a 97% increase in the OTR price. When you look at the BoE inflation calculator (very basic and there are discrepancies), the Fabia should be in the region of £13200, a 32% increase with inflation. Dacia to their credit are still offering a baseline Sandro at £13750, which don't get me wrong is still a 63% increase in the OTR price of 2014 at £8395. For the EV market to thrive, you need a bunch family hatchback size models at sub-14/15k prices to hit the market TODAY. Making it more accessible for lower to middle income earners that will eventually sell on at the 3/5 year mark which makes even more people able to access EVs. None of this bullshit of Peugeot E-308s having a baseline OTR price of £40,000, or VW ID3s with £36000 OTR pricing, just locking more people out of EV ownership.",@alistaircampbell2129,0,2024-04-13T02:31:14Z
"Some of the oldest Leafs in US now have 30 miles left. matt’s leaf only has a mileage of 44k, that’s a nee car! Quite a large brick outside your home just to eventually drop to 30 mile range. Yes great for city bad for anything else.",@will3102,0,2024-04-13T02:30:09Z
For an eletric car it is a very old car😂😂. You 2013.,@Luis-cr1tw,0,2024-04-13T02:18:52Z
When Nissan leaf came I want one I am glad I didn't bought one😂😂,@savneetsinghrairai6823,0,2024-04-13T02:17:27Z
Some earlier models of the Leaf 2010-2012 has a heater core leak which caused dampness in the car and the front window to fog up. Once Nissan updated it to a heat pump that issue went away.,@spaceman7915,0,2024-04-13T02:08:32Z
"Is this review an ""April Fools"" trick??????????!
It used to regard Mat as a reliable and trustworthy car reviewer, but having watched and listened to this utter Bull shit I am having to change this opinion. How anyone can suggest that a car with a universal water leak and a total range of 60 miles is a viable proposition is beyond me. And the AA has to be on standby every time you expect to travel anywhere near the total mileage!
PS If you drive the car on a cold winter day the 60miles will reduce to 45-50 if you are very lucky.
PPs In real-world driving the 60-mile range is really 30 miles to allow for the return journey, without having to stop for several hours to recharge the battery.",@banditbaker1675,0,2024-04-13T01:58:39Z
Imagine if someone hit the car and trying to get a repair shop that can find parts to repair it.,@grimreaper4801,0,2024-04-13T01:57:31Z
"I'll stick with my gasoline powered cars, thanks.  They're paid for and don't have range problems.  Just the same, interesting video and I thank you for sharing.",@fsj197811,0,2024-04-13T01:23:58Z
Alternative title: LEAST KNOWLEDGEABLE JOURNALIST DOES IT AGAIN,@h20dancing18,0,2024-04-13T00:46:40Z
I was all in on this car until I saw that the glove box wasn't damped. I'm out.,@KevinLaffey,0,2024-04-13T00:23:26Z
"I am driving a 2005 Prius II with around 400k miles and on its third battery. Still comfortable, still ~40MPG on average. I think hybrid was and is still better than all-electric for the consumer.",@RichardLucas,0,2024-04-13T00:17:22Z
"I went to a Nissan dealer with the fam to see if I could fit a kids car seat in the back of a GTR and came out with a Leaf.  Hated it.  Range was a problem for us from the first week.  We leased it for 3 years, tried hard to make it work for the first 12 months then gave up and I bought a Maserati Granturismo which I loved and kept for 10 years.  When they collected the leaf the report said 'much moss growth'.",@coolretro,0,2024-04-12T23:55:17Z
"So, you get a 911 and you’re wife gets a leaf WOW",@pdammer5828,0,2024-04-12T23:53:29Z
these are going to be like other electrics once out of fashion and the battery has gone they'll just go to landfill,@fatboy7276,1,2024-04-12T23:49:24Z
"People forget that 59/75 miles new (not sure why he said 120+ miles) is 78% of 24kWh which is 18kWh battery for £1500. That's incredibly cheap. Just buy an old LEAF remove the battery for a stand alone battery back up for 1/10 the price.

Someone needs to make a business to do this.",@zigadabooga,0,2024-04-12T23:48:55Z
Well brand new ones are so yes,@donaldsalkovick396,0,2024-04-12T23:39:21Z
The EPA estimated range of a 2013 Nissan Leaf was 75 miles. Not sure where the 124 mile range came from.,@cameronmayfield326,58,2024-04-12T23:29:05Z
That happens in my Nissan Qashqai. Tonight I had 215 miles range. Drove 22 miles. Now it says 211 miles range. That’s diesel for you 🙄,@gordonmackenzie4512,0,2024-04-12T23:24:45Z
it seems the nissan leaf is superior compared to modern ev cars,@billyhatcher643,0,2024-04-12T23:20:28Z
Just buy a petrol car takes 3 minutes to fill it up get hundreds of miles and don't have to cause more environmental damage to build a electric vehicle than it does to run a old petrol car,@JamesRogers-vs4vb,1,2024-04-12T23:05:44Z
The Leaf is well known to have no thermal management and terrible battery degradation. It’s failure has nothing to do with EVs in general. I have a 7 year old Chevy Volt and basically no battery degradation.,@brettsherman7810,0,2024-04-12T23:03:25Z
"this would be almost useless in canada, (especially if its winter and needs the heater on), the nearest other town is like 65km away,",@jamesfernick3741,1,2024-04-12T23:03:10Z
"Dont worrry people, the UKs national grid has 2% remaining capacity. If we all go electric, the lights will literally turn off",@peanuts2105,0,2024-04-12T22:59:00Z
I do 44 miles a day on a 4 day week. Is it a good to buy one?,@peanuts2105,0,2024-04-12T22:57:22Z
"I swear that at first I was reading the licence plates as ""Big Nope"" 😂😅🤣",@Leo.501,202,2024-04-12T22:50:26Z
"total rip off, poor design, worth very little",@DommoPA,0,2024-04-12T22:39:20Z
"I bought a 2017 30 KWh model in the ""Tekna"" spec (Leather heated seat and steering wheel, 360 cameras etc) last year with 144,000km on the odo, and as a second car it's a fabulous option. This model looks like it's been abused. with an extra 80,000km on my clock, there's no issues with mine. I've only ever had to use public chargers twice since the end of May 2023.

One thing that people don't take into consideration is that the faster you travel, the more you go through your charge, kinda like the difference between using your phone screen and not. An advertised 124 mile range I would presume is Urban driving where these cars excel. And EVERYTHING uses battery - AC, radio etc. During the summer I feel confident using it for the daily commute on 2 days (50km round trip) but in the winter I charge it every night due to the extra power used with the AC, as well as the way batteries are less efficient cold.",@mrrayner7162,2,2024-04-12T22:26:42Z
"Rich people can not sell their old Evs , so are paying YouTubers to promote them !",@rzvr4490,0,2024-04-12T22:24:18Z
"Carbon theft, 15 min cities, clean out the suckers. Batteries worth more than the car itself, doesn’t quite the drive of the testing hardware. Massaging egos. Crook.",@Pathofplenty,0,2024-04-12T22:14:48Z
Nice 1. Finally a video which proves battery engined cars run better with real fuel.,@peterf5318,0,2024-04-12T22:14:30Z
I’m guessing car wow don’t offer much for used electric hence the 1500 price in auto trader it’s probably 4k,@AndrewDRSWilliamson,0,2024-04-12T22:11:22Z
It’s perfect if you never go further than 5 miles from your home,@AndrewDRSWilliamson,0,2024-04-12T22:08:42Z
Ev are aa pointless solution to an issue that doesnt exist,@sleeka91,1,2024-04-12T22:03:52Z
Shitty  electric  car would  not won't one if it was given  for  free,@simeonselmon8318,1,2024-04-12T21:58:24Z
"Could be good for a second car. It was very very cheap, I have not seen anything like this here in Hungary. The range is really terrifying to me.",@mullergyula4174,0,2024-04-12T21:55:31Z
My 28 year old toyota gets around just fine,@chownzi2461,0,2024-04-12T21:55:26Z
"I'm wondering..does this car have electronic brake? If so, in similar case in the mountains would it just fall from the cliff? xD. I know it has hydraulics, fluids etc. But the button itself is electric",@tomaszagowski3256,0,2024-04-12T21:52:50Z
Unironically the Leaf is the only EV worth buying. EVs are only good for around town cars that never go more than maybe 20 miles a day.,@pyromcr,0,2024-04-12T21:51:29Z
About as useful as an ashtray on a motorbike. Mark my words EV CARS will be the new PPi.,@smithyc2051,1,2024-04-12T21:45:50Z
"2017 leaf with 105,000km and 73% battery.  Works great for a purely city car.  Range estimates are not very reliable and depend highly terrain, speed and temperature. But you get used to it. I have done a few road trips in 100km intervals with careful planning and a lot of patience. For 99% of people, don’t do this. Lol.  Super cheap to run (van Canada kW prices) and easy to drive.  I generally just bite the bullit and charge to 100%.",@MichaelJohnson-kw2mx,0,2024-04-12T21:45:17Z
Old Leaf with no battery cooling. Not representative of EVs today and what they’ll be like ten years from now.,@therealcaldini,0,2024-04-12T21:29:27Z
Half the capacity at 44k miles is atrocious 🤣🤣 talk about carbon footprint,@joelawson5329,0,2024-04-12T21:23:04Z
It doesn't worth even 1500 for 60 miles... pathetic EVs,@LudmilMetodiev,0,2024-04-12T20:59:21Z
The smell is leaking boot water under the carpet of the roof the seals have failed it's a fault on the leaf two of my previous ones had this also windscreen can leak and cause water in foot well,@davidyoung3402,0,2024-04-12T20:59:08Z
Perfect little car. My boss is a millionaire and owns an old one of these to get to and from work. I wonder was the intention of this video to create some anti-ev click bait and it actually backfired on them. All the comments are positive.,@jj45678o,0,2024-04-12T20:58:31Z
"To save me 23 minutes.

Yes, they are a rip-off because BEVs are a scam to trick anti-nuclear retards out of their money.

But idiots will be idiots, what annoys me most is that we're all paying for it in more ways than one, both in environmental damage, and out of our hard-earned paychecks.",@_Anato_,0,2024-04-12T20:57:19Z
"EV batteries are like iphone batteries😂 they get worn out and need replacement😂 I already have stress of replacing a phone battery, now imagine a car😂 sticking to petrol *(my opinion)*",@lightsout9171,0,2024-04-12T20:54:00Z
This was actually super interesting! Reminded me of SavageGeese 👍,@GoO0f,0,2024-04-12T20:50:20Z
"From a sustainability standpoint EVs are an absolute nightmare. No one wants a used one because if the battery sucks you're well snd truly out of pocket paying for a battery repair. The deprecuation on a 4 year old Jaguar I-Pace is insane, you can pick them uo for less than £20k. Once a £60k car.

My 10 year old car still works fine and has the same range, and I'm sure once I'm done someone else will want it. EVs are just ewaste after 8 or so years. 

Such a shame, hooe the battery repair options are going to improve!",@Krysstophe,0,2024-04-12T20:47:15Z
What happens when one of those packs runs away… that warehouse will become a volcano,@atnit86,0,2024-04-12T20:45:19Z
"i have 2011 Leaf, bought 29K Cad back in 2010 Agust. just replaced the battery for 8K 62KW battery, now we have 400Km range. Leaf is a great car.",@m.necatisepetcioglu4391,0,2024-04-12T20:41:35Z
Pulled out of the parking lot. Have you been yankified😔,@consty715,0,2024-04-12T20:40:33Z
"imagine commute (plenty of people commute round trip under 50 miles daily) on a $1,500 car daily for few years and saved $10,000 on gas alone....then use that save $10,000 upgrade to another newer generation (used) with bigger battery",@Steve-wo9uy,0,2024-04-12T20:38:35Z
"Electric cars aren’t the future, hydrogen and synthetic fuels are",@jonhandle,0,2024-04-12T20:27:31Z
Yes. Disposable vehicles not unlike mobile phones. Built to last a few year and lose all value. End of the debate.,@alexbremner8361,0,2024-04-12T20:24:07Z
Now do the test in winter and snow.,@masoudv148,0,2024-04-12T20:23:42Z
"A friend of mine had one of these. The heating is rubbish, it always had condensation on the inside in winter. Thats why yours its full of mould.",@Farney-gy1qo,0,2024-04-12T20:22:12Z
Another reason not to buy an EV.,@jamie-hb8gy,0,2024-04-12T20:16:16Z
"would you buy a used smartphone? No. Why?, because most of it is battery. Batteries degrade over time and are very expensive to replace and very toxic to manufacture... So who, outside of someone who has no choice, would buy a used electric vehicle.... I hope the whole electric car fad dies off sooner than later, and people come to realize that we need something better",@cb7pwn,0,2024-04-12T20:15:46Z
"In real world use I'm still not sold on ev,s 
Limiting the distance you can travel on a charge and then the time it would take up to charge again to continue 
I know you are talking about a vehicle to potter about the village ,but you many as well invest in a low emission petrol vehicle and dump the anxiety",@mancsblue,0,2024-04-12T20:12:55Z
Will you be reviewing the new countryman that you’ve been using as your support car in the video?,@dan_wilkinson,0,2024-04-12T20:11:44Z
"Leaf range has always been terrible… Nissan lied, (as all car manufacturers do) about the car’s performance… it’s ok as a local runaround tho",@francescaf7967,0,2024-04-12T20:11:39Z
i have similar... it ROI 100% after 22k kms .Great for even large city daily commute. For outta city i have ice,@alexandermurghulia7140,0,2024-04-12T19:53:10Z
My 2003 Mercedes C220 does 400 to the tank. Bought the car for £1500 before Cpvid. It's cost me £800 for MOT work in 5 years and i have serviced it myself. It runs like a dream. Tell me again how electric cars are the future? Because without new batteries this car is a paperweight.,@lifebydrone,0,2024-04-12T19:49:21Z
"This would make sense as a second car for going to the shops etc, but not as an only car, this isn't enough range even for a cheap run around. No one will want to run it absolutely flat like this, so you are probably drawing a 15-20 mile radius around your house and that is your limit.

Newer EV car batteries are better and bigger, but at the 10 years mark will have done more miles and charge cycles than a car that only did 80 ish miles to start with. So this is probably pretty representative of what you will get. I expect this is why some of them are depreciating rapidly. There won't be many EVs over 10 years old and still on the road, so they don't have that base residual value.",@codemonkeyalpha9057,0,2024-04-12T19:44:19Z
"If you decided to lease the battery, are you not entitled to swap it out for a new one in the range reduced to 50%??",@user-se1gb3su9x,0,2024-04-12T19:42:38Z
Still for 1.5 and even if you spent 1k to service the battery its a great city car to go to work and back and short commute! Also thats the worst battery chem out there!,@sale666,0,2024-04-12T19:41:18Z
Can you guys do electronic car test like the one which the longest car to die,@NjabuloNyikiza,0,2024-04-12T19:23:02Z
"So, although it cost £200 less than my 2008 Astra Estate, it accelerates quicker. And it may be even cheaper to run that the 1.9 diesel, and get me to work and back daily, but run out on Friday afternoon, and  I'd have to to stop and charge it at least 3 times on the way to visit my sister every month. Oh, plus I've nowhere to charge it at home.
xxxxxxxxxxxxxxxxxxxxxx No electric cars for me thanx.",@wordreet,0,2024-04-12T19:21:08Z
"1,500 for that is not bad really. 
If you have a place to charge at home you will save much time and money. 
(ofc. except if your're living in Germany, where e cars are more expensive to run than diesels xD hahaha, long live the ~200% tax on electricity in Ger)",@surrealengineering7884,0,2024-04-12T19:03:32Z
"Why not have a Range Rover or something tow you while you hit ""regen"" to put some juice back into it.",@natehill8069,0,2024-04-12T18:48:19Z
Cheaper than a golf cart. Can you take it on a course?,@natehill8069,0,2024-04-12T18:35:50Z
Don’t get why you would lie about the price?… your own website (carwow) would give £2566 for it and carwow always lowballs on price.,@benhaz5006,1,2024-04-12T18:34:01Z
"Would people be ready to go back to a basic car without any electrical accessories. I say None like: no power steering ,  window with crank , paper map : no infotainment ...nothing . My own answer is Yes, if it prevents me from calling towing just 1 mile from my destination. But this type of car is not offered. Instead only cars  over 25k $ filled with ''option'' not essential to get from A to B. By the way the only thing to do with this Leaf is to re-engine it with a small ICE like a 25hp predator v-twin.",@cabaneencac5168,0,2024-04-12T18:28:45Z
"I dont remember a new Leaf in 2013 having 124 miles on a charge, I remember it being more like 80 back then. Later versions had a bigger battery.",@natehill8069,0,2024-04-12T18:25:00Z
"The whole EV idea is so fundamentally flawed. Broken secondhand market, insurance cost because of the dangers of battery fires/explosions, the general danger of damaged batteries in car parks and/or accidents, the impact to independent garages, the accessibility of cars to low income households if they were ever to become mainstream, the list goes on and on.

Bio fuels are surely a better solution, the same infrastructure can be used, everything else remains the same, less damage to the roads without heavy EVs. 

EVs are not the solution.",@Grevane,0,2024-04-12T18:22:59Z
One major thing I've noticed about ev's is that there doesn't seem to be any meat on the bone for the consumer. No value left for the user. Won't drive 20 yrs without a new battery and worthless without a good battery.,@ScaldingHotCatsup,0,2024-04-12T18:15:38Z
"$1500? Not bad at all! I'd love this to drive in Montreal, just a city drive.",@KyleRuggles,0,2024-04-12T18:15:21Z
"That's a Jap import leaf before they started building in Sunderland. Don't think any cream interiors came out of Sunderland. The battery tech got slightly better in Sunderland. Mines a 64 plate and I can still get 67 odd miles of range. The running costs of mine have been very low (103,000 miles now, had from new), it's part subsidised by gov due to no road tax and no fuel duty but i've saved roughly £18,000  over running my old 45 mpg golf. Great for daily commute and school run etc. Buy one of these and a muscle car for the weekends.",@heatleynoble,0,2024-04-12T18:09:04Z
"Hold on... you bought a 10+ year old car, with probably NO service done for the battery, and you're surprised it's lost range? Tell us you don't know how batteries work without telling us you don't know how batteries work.",@SomeNerd361,0,2024-04-12T18:05:23Z
"I was remembering that the early Leaf's only had an effective range of about 80 miles at least here in the US. So, an 11 year old car that now has 60 miles, I don't think is terrible for 1500 quid. For an around town car, I think it is a great deal.",@michaellynch1132,53,2024-04-12T17:54:04Z
"In the mean time..
My 2003 vauxhall combo diesel van that has done 475,000 miles without needing to be rebuilt.
In the real world still does 550 miles per tank of fuel while its carrying a heavy load of tools and materials for work.
It only takes 5 mins to refuel.",@sahhull,0,2024-04-12T17:38:54Z
If the EV was a viable solution.  The government wouldnt need mandates and legislation to force the people to buy them.,@sahhull,0,2024-04-12T17:30:11Z
So in summary stay away from electric cars.,@latitudeash,0,2024-04-12T17:21:47Z
Could always fit an engine in it 😂 be cheaper than a battery and get about 500 miles on a tank instead of 60,@bigfist255,0,2024-04-12T17:13:16Z
"don't forget the leaf doesn't have any battery management, hence why they've done so badly. There are companies doing replacement batteries for the original leaf though I think it runs to about £16k?",@alschannel,0,2024-04-12T16:49:50Z
I don’t lose 30% of my fuel tanks capacity in 11 years. My range is unaffected.,@keegan773,1,2024-04-12T16:38:00Z
"Sorry a win? What sort of properganda are you trying to push here? These were terrible from new and are still terrible. 35% less than claimed as a new vehicle? That's borderline criminal. They can't be recycled and they just rot and clog up the industry. I can buy a 50 year old car with a tiny little petrol engine that will still give a claimed mileage in the tank of 95%+. Used EVs are a terrible investment. If you are desperate get a Bicycle or take the Bus or just WALK. If you have no choice, get an old but healthy petrol car...not diesel, and you'll be fine. This is some impressive BS here Mat I'll give you that.",@dramen,0,2024-04-12T16:32:33Z
Leasing the battery can’t be a bad thing tbf,@norbertkando7574,0,2024-04-12T16:29:13Z
you could also just use leafspy or leafspy pro with a odb dongle.,@MrMarty77,0,2024-04-12T16:19:10Z
"£1500 because the battery costs like £7 grand to replace but to be fair once that jobs done it would last another 11 years , feel sorry for me i got ripped off at weekend paid £3 grand for a 2013 Fiat 500 and the seller a Dealer called A and A Car sales in Farnham never told me the gearbox was bad so had to spend £800 putting that right , not good at all",@christineayres7199,0,2024-04-12T16:17:57Z
"6:42 Only 44K miles on the clock and the range has already dropped 50% from new. Even lower in cold weather. Absolutely ridiculous.  With <60 miles range, every trip must be an anxiety inducing slog. Your basically limited to a 25mile round-trip range. ie. a 25 minute drive at 60mph.  And hope you don’t have to make any unscheduled emergency trips later the same day since it takes hours to recharge. What’s funny is all the delusional ‘this is fine’ comments from EV owners.",@brickmissing8295,0,2024-04-12T16:01:12Z
"Loved the water dripping into the boot, you'll soon have your very own mini swimming pool.  The car wins the least healthy car to own award due to mould",@bittripper3530,0,2024-04-12T15:33:52Z
"It NEVER had 124 miles of range. It been proved time and time again that the range is on average 30% less than quoted. You had 87 miles from NEW, youve lost 30% of that in 11 years. Thats shit! 😂",@stuartcraigon2003,0,2024-04-12T15:28:30Z
"""Electric cars are like old phones, nobody needs them, and you won't get far on them. Within the city, no more than 20 km, and that's assuming you don't turn on the air conditioning or heating. The car is just a useless piece of junk.""",@Pontiw,0,2024-04-12T15:06:59Z
"I was going to complain that Mat picked the absolute worst case with the original Leaf, but even a £1500 one comes out smelling like roses. Good one!",@ingogud,0,2024-04-12T15:06:42Z
"I would never buy an used EV with current tech with more than 4 years, never, the battery alone will make you cry.",@profounddamas,0,2024-04-12T15:05:11Z
What happens if you don't pay the battery lease,@liameley9380,1,2024-04-12T14:54:43Z
"A bit of a misleading headline, particularly in conjunction with the picture of it being recovered.  Apparent suggestion - they're a rip-off; actual conclusion - they're rather a good deal.",@johnwinters4201,11,2024-04-12T14:43:33Z
We have a 2015 Fiat 500e. About the same mileage as this Leaf. It has 100% of original range. We love it!,@usa-ev,0,2024-04-12T14:19:06Z
"Guys, Auto Trader and Rory already did that some months /a year ago. That video is a total rip-off",@graffitimanbg,0,2024-04-12T14:16:43Z
Funny how any positive EV reviews get very few views,@jon-ie4li,0,2024-04-12T14:08:12Z
i think a hybrid car would be the way to go for the enviroment because all you do when you run low on fuel is to it up with petrol,@matthewjones9733,0,2024-04-12T14:02:21Z
