text,author,score,datetime
"i have a 2014 leaf and commute 64 miles per day,no problems,1.85 cost on nitely recharge",@bubbybunyan3883,0,2024-05-03T21:36:37Z
"Excellent review right here , Thanks.",@stevensmith8454,0,2024-04-27T18:59:59Z
"A lot of noncense, i drive a Nissan Leaf since 2018. . No problems at all. Okay chademo not the standard anymore bur available ,  I  drove from Holland to the south of France. , nor any problem by loading with chademo I like this car..",@ariejanbak7521,1,2024-04-25T15:28:13Z
About electric hand brake. I have Nconnecta model so I can say that it doesn't have that. Instead it has a foot pedal break and it works by pressing the pedal down (and also releases by pressing it down). Is it still hand brake if you use it with your foot? I don't know. But it works very well and it never goes on or off by itself. It is all manual.,@user-pz8sf8rb8i,0,2024-04-21T18:00:50Z
Plenty of smarty-pants negative comments on here but these are mainly by know-all types and best to ignore. I use the Leaf for short journeys and town driving for which it is a real winner. Home charging means I am saving big bucks.,@jaxthename,1,2024-04-17T21:10:06Z
I gather the charging rate (3:33) was 6.6kW for 7 hours (46kWh),@cambridgemart2075,1,2024-04-05T17:49:25Z
"I'm thinking of trying either a late 30kwh gen1 or early gen2 leaf on my parents. They are getting on and increasingly use their small car for very short trips, less than a mile and a half each way. They used to walk most of the time but aren't so capable of that now. The small petrol car they have doesn't even fully warm up, sometimes for several trips in a row and as a result is causing the warning light to come on. They never take it more than about 30 miles from home either and rarely that far, so an 80 mile range and only home charging is no problem. An electric motor doesn't care how short your journeys are. 
The only problem is my Dad won't have one because it wouldn't be capable of a theoretical journey that he hasn't been on in the last 15 years and never will go on anyway, but he will have a petrol car even though it is likely to mean some huge bills in the future when the catalytic converter dies due to the useage.",@bazzacuda_,2,2024-03-29T00:57:46Z
It is Japanese yes dated in design and tech but it will be reliable if looked after! Think about that aspect.,@atlaspath5803,1,2024-03-18T05:52:39Z
"Of course you like the look of the speedometer....looks like a Daewoo Matiz one
There is never ""to much power ""😂",@justme-uw2hc,0,2024-03-15T16:57:34Z
"I've owned an e+ Tekna one of these for three years and am very happy with it. Even the 62 kWh doesn't have any battery active thermal management, but it matters less with the bigger battery.

Don't do much public charging, but on one occasion, I jumped the queue for CCS as I was the only car that could use the one chademo connector 🤣",@timw1971,2,2024-03-04T11:20:06Z
"Great video 👍 There is a CCS to ChaDeMo adapter but very expensive at almost 2k dollars 😬 Dales EV repair has some great videos about the development and final product. BR, Per (Denmark)",@nakfan,1,2024-02-23T03:48:29Z
"Hate the way that car styling is going with the angular lines all at conflict with each other. This car essentially the same shell underneath, but Nissan felt the need to remove all the smooth curves and replace with odd angular shapes.",@a1white,1,2024-02-18T10:23:03Z
Let's just pause a while and reflect on all those who got bitten by the EV  bug and rushed out to buy a Leaf...................................😅😅😅😅😅😅😅,@QuoPaperPlane,2,2024-02-17T19:20:13Z
"It was never vey good, no BMS.  Shame.",@toad008,0,2024-02-16T19:21:21Z
there are design compromises when building a chasis for petrol and electric. nissan and tesla started electric cars and have the best track record. nissan will be all electric soon too!,@MatthewEng2593,1,2024-02-16T18:56:06Z
"Ive had a leaf now for almost 5 years. Its a great family car, for the price, an interesting option for those able to charge at home.",@logividarsson9031,2,2024-02-14T14:09:52Z
ive one on company am leaving job considering buying on finance payments personal be 450 a month but would be me owning it instead. But how long before a need yo reaplce the battery pack am already on year 3 range is still good and 100% health. but ive already paid 3 years if a take finance be a futher five years paying it off,@dotnetdevni,0,2024-02-10T04:29:39Z
It’s a good reliable and affordable EV for people who are really on a tight budget and who wants an electric vehicle it’s simple and minimalistic.,@EVUSERS98,2,2024-02-03T05:53:55Z
"A more balanced review of a fairly modern car regardless of the power source.

A vehicle with a reliable 150 miles even in winter is more than sufficient for 95% of drivers.  The average car use per day is around 20 miles in the UK and most people do not go on journeys of over 100 miles with any sort of regularity.

We have an EV.  It's not a Nissan though it has similar battery capacity and motor power but will do more real miles than the Nissan does.   Our everyday need is low but round trips with an oldie to the hospital can result in 80 plus mile days.

We now have the ability to charge on cheap juice overnight even though we live in a Victorian terrace.  Local authorities are slowly but surely making this happen.

I love cars and my all time favourite is the Ford Anglia 123E Super with the 1200cc engine.  We had a 1967 vintage version and I loved everything about that car.   To be brutally honest though in the modern world a modern car is so much safer and more practical.",@michaelgoode9555,2,2024-02-02T10:32:21Z
Wonder if you can get an adaptor for that charging? Just a thought .,@gazzertrn,0,2024-02-01T19:15:59Z
Awww this reminds me of old fashion hub nut. I miss those days,@ttbdrummer,1,2024-01-31T22:50:07Z
"This car is 10 Years behind the Hyundai Kona
Kona 40kwh has Alien Technology compared with this one it gets a 110 miles more from the same 40kwh capacity 😳",@niceboy60,0,2024-01-31T17:46:09Z
"I love my Nissan Leaf, but I do wish it had from the onset ATM and CCS. Though at least there's an adaptor on the way. And it's perfect for my needs. Not to mention that it drives well in the winter, if for the shortened range.",@AurumUsagi,0,2024-01-30T18:43:21Z
"Wow, i didn't expect to hear Aberystwyth when clicking on this video. Lived there for 3 years and i miss is dearly, i'd move back in a heartbeat if i could.",@Quickb3n,1,2024-01-30T10:51:09Z
"Chademo is an actual standard whereas CCS has variations between manufacturers. Chademo is also designed with V2G in mind and V2G/V2H functionality was mandated for Japanese manufactured EVs in the wake of Fukushima as is presents the potential for EVs to provide grid resilience by acting en-masse as a utility scale grid storage facility.

We're onto our second Leaf (2012 24kWh, 2016 30kWh) and use of public charging is virtually nil for us. The upgrade was actually done last year with V2G very much in mind as we have solar and I'm hesitant to spend money on a static battery when a Leaf can do the job plus provide mobility.

Some very interesting info to be had in Robert Llewellyn's interview of David Slutzky of Fermata Energy on V2G's potential in electricity supply resilience and gaining income from your Leaf by way of their bidirectional charging functionality. Worth noting also that EV manufacturers are reacting to V2G demand and are now increasingly incorporating this in their vehicles, but the humble Leaf has had this almost from its debut.",@HarmLessSolutionsNZ,1,2024-01-27T01:18:08Z
"As far as cold weather goes ... the 2019 LEAF we bought two months ago has just been through a week of sub-minus-30 weather. (I live in Saskatchewan, because I am insane.) Never needs a boost, the cabin heats up in five minutes compared to 20-30 for the old Civic. The range isn't great even with the 62kWh battery, probably 150km in that bitter cold, but we're not regular highway drivers so it's just fine - and that's a worst case range, worse than worst-case for you Brits. Plug it into the side of the house at night, it's charged in the morning and you really don't need more than that. Best winter city driving car I've ever owned. I kinda like the ""old-fashioned"" interior with buttons for most things rather than having to navigate touch screen menus, too.",@stmisbehavin662,3,2024-01-27T01:01:29Z
"Great video, but you can leave the parking brake on the 500e off... https://youtu.be/WiTimog-TSk",@theweekthatis,0,2024-01-25T19:21:57Z
"I believe that a CCS to Chademo adapter is now available. I saw a video about it recently.

https://www.youtube.com/watch?v=wydql2N_F-k",@aftonline,3,2024-01-25T09:29:23Z
Very fair and balanced assessment.,@briangriffiths114,1,2024-01-24T13:07:31Z
Is that a man made sea wall of some sort at the end?,@alastairward2774,0,2024-01-24T12:56:10Z
"Id still LOVE to have a Leaf despite its age, im a big Nissan fan anyway but ev cost is still above my wallet level (and others?) and i think thats what is holding them back right now 😢",@Boating_David,0,2024-01-24T00:10:30Z
"I've had a 2014 Leaf (24kWh) since 2019 and it was the most expensive second hand car I've ever bought (£7,500). But 4½ years later it's paid for its purchase price in fuel savings alone compared to the 2005 Honda Civic it replaced. In October we had a V2H (Vehicle to Home) charger fitted and now I can charge it on cheap overnight electricity and use it as a battery to power my house (and soak up free power from my solar panels). For our family it's the gift that keeps on giving.

It's a great daily driver, like you said it's not exciting but it's very competent and it only costs us 2.3p/mile if we charge at home (we get a lot of free solar miles in the Summer too).

The bump in the middle of the rear floor is where the high voltage emergency disconnect lives, in the event of an accident the emergency services can pop it open and remove a plug to isolate the battery. With regard to Chademo, we're just beginning to see CCS to Chademo adapters as commercial products (>£800) so there will be some scope to keep using Chademo vehicles in the future.",@jarthurs,1,2024-01-23T22:09:45Z
"I’ve had my 2018 leaf Tekna 40 kwh for 3 years , It has 98000 miles on the clock but still drives perfectly and everything works as it should . Leafspy says my battery capacity is ~86.2% . Great little car .",@antoniopalmero4063,2,2024-01-23T18:00:58Z
"Driven one for twelve months nearly. Love it, as a vehicle to both drive and enjoy - and with 99% of charging at home on off-peak it's very cheap also. I've needed a rapid charge I think five times in that time and never had a problem finding a chademo. In the UK there are probable more CCS, it just isn't as much of an issue as I think people are making it - to most users",@sstirley,0,2024-01-23T15:08:18Z
"It has a Bose soundsystem, you just can't expect the bass to be 'rounder' , just more distorted.",@WouterB76,1,2024-01-23T14:35:37Z
"Sorry, I'm a Petrol Head not a Volt Head.",@IanM18,1,2024-01-23T13:04:07Z
"They would sell a ton of them if they switched I've from CHADEMO to at least CCS, but preferably NACS.  It's a mystery to me why Nissan haven't made that change.",@jeffcranmer5374,0,2024-01-23T00:49:13Z
Perhaps the sakura is more worth it,@clarksonoceallachain8536,2,2024-01-22T21:20:40Z
"As a automotive enthusiast I can't recall exactly when the Leaf was considered "" relevant "".
Personally I don't think the EV faze is relevant now. The whole thing is a cash grab by megacorps on an idea pushed by a charismatic CEO of a certain company. He convinced the dull masses of the world to think electric motors for vehicles were a modern or new idea. They are not. 🖕",@JL-go3,0,2024-01-22T20:01:34Z
Great down to earth review.,@tolrem,0,2024-01-22T19:00:24Z
"EVs are a technology going nowhere, in my opinion. 
The charging hassles are one of many problems. I see batteries as the cursing factor, with many aspects. Unless battery technology makes massive advances in the near future, EVs are a big failure. Winter, heating the car electrically is a disaster especially if you get stuck in any way. The tendency for batteries to burst into flame must be cured, at minimum some way of predicting the risk. Power storage is far to small. The batteries require relatively large amounts of rare earth minerals, these will be harder and harder to find, so a way of making batteries that store more energy without the minerals, a huge technology jump..
Talking Heads got it right ""Road to nowhere""",@umvhu,2,2024-01-22T17:09:13Z
"ChadEMO is dead.   The leaf is dead.  

It died on the vine and Nissan FAILED to modernize its battery and drivetrain.",@Derpy1969,1,2024-01-22T16:09:37Z
Nissan do have good strong whips. The production line is relentless having got a job there and moved on fast. Not for me. It did open my eyes though on the entire process.,@1990JohnG,0,2024-01-22T15:57:05Z
"EVs - if you live in a flat, you're screwed.
If you want to go a long distance, you're screwed.",@julianevans9548,5,2024-01-22T12:19:21Z
"An EV would probably suit  my needs, so my next car could be an EV.  But it would have to be a used one for my budget maybe a Zoe, a leaf or a kia Soul ev. Then I would make my decision after test  driving all 3. 👍🤔",@rahmann936,0,2024-01-22T10:58:19Z
"A very fair and, dare I say, professional review. Well done.",@GoldenCroc,1,2024-01-22T09:43:16Z
"Ian, are you going back to long hair?",@stottybox3185,0,2024-01-22T08:15:50Z
"The Chadamo makes it the betamax of modern ev cars.  Just charge at home and you'll save money and time.  Avoid roadtrips.Nice car, good review.",@martinwood9014,2,2024-01-22T06:57:01Z
Battery powered cars are not the future.,@zog97xy,2,2024-01-22T01:05:55Z
EV's are on the way out now. No one wants them anymore.,@stoptheplanetiwantoff6906,3,2024-01-21T23:53:32Z
"I love my Leaf Ian... Ive just bought a 21 model 62kw Tekna like yours here for £16K at Car Giant in London with 20k on the clock... But sadly it might have to go back... why the insurance ! I was quoted £1500 for the year but when it came to buy the insurance 3 flags came up from my cousins additional car on my Employee Leasing Vehicle Scheme making my insurance jump to £7000 !!! 😧😲 Sadly EV insurance has narrowed and in the passed these flags could be overlooked as there was competition in the market 5 years ago,,, Now thats not the case and there is no market for Budget EV insurance as there is no competition there since Covid with many independent insurance providers falling by the wayside..",@ianmax69,0,2024-01-21T23:52:49Z
"Whatever your view on Electric vehicles is and speaking to all male compatriots, please do not stick your penis in any of the charging ports.",@VLG105,2,2024-01-21T21:52:14Z
"CHAdeMO to ccs adapter now exists 
https://www.youtube.com/watch?v=wydql2N_F-k
This literally solves the number one problem with owning a NISSAN LEAF EV and makes it so they can now use any and all EV public fast chargers ... With an extra Tesla NACs adaptor can also do that Tesla supercharger network which is more than doubling the number of charge stations it can use and making it be able to use more than any other EV. 
This makes the Japanese EVs with this plug be the best EVs on the road for been best value and best reliability and best styling and best EV network access ... Once owner has all adaptors...
Is it a conspiracy that the YouTube partner EV news channels are so far all ignoring this breaking most important news item because it goes against their anti-japanese liar campaign to always put shit on everything from Japan 🗾... 
Even tho the leaf has always been the best EV for so many reasons like the only EV that never blows up and Japanese EVs brands have never had a battery fire....!
Japanese cars have always been the most reliable and highest quality and longest lasting. This is still true for their EVs.",@TimBorg,4,2024-01-21T21:04:38Z
"LEAF = BEST EV for; build quality, Safety (only EV to never have a battery fire) value, looks and styling, sexiness, quietness, type of EV, most practical EV, most advanced JAPANESE TECH 
With the CCS to CHAdeMO adaptor now available the LEAF can use more public fast chargers than any EV with only CCS
Tesla = Lowest quality most dangerous always exploding fire hazards on the roads... (most common EV to have battery fires and major design flaws),,,.,,",@TimBorg,2,2024-01-21T20:59:57Z
Brilliant observation about the handbrake. My Renault Zoe has an electric handbrake that the car insists on turning on and will not allow me to park off handbrake free. If I leave the car for two days or more it welds itself on and I get endless weird error messages as I try and force it to release it. A good BANG!!! later and it finally releases which is loud enough for pedestrians to turn their heads to see what has happened. It really is a major pain and shows simple bad design.,@mbak7801,0,2024-01-21T20:56:52Z
"I like the wheels, their design is reminiscent of the coil windings on an electric motor. There don't look like much fun to clean though.",@MikeSamuelsII-ve8gp,1,2024-01-21T20:52:40Z
"I had a Leaf for two years. After 8000 miles its range was 35 miles in winter at night (- heater, lights, wipers etc). It needed a new £5,000 battery. Factor that into your running costs - £2500 per annum for batteries. The dealer said the 5 year warranty is void because I plugged it in to recharge it when it was already 80% full. Apparently the same applies if you let the battery go below 20%. In which case the useable range is actually 60% of its real range, which in turn is probably 85% of the manufacturer's claimed range. I have solar panels at home so of course when the sun shone on them I plugged it in. You would, wouldn't you? The dealer never told me not to plug it in if it was already 80% full, and why did the stupid computer on board allow this? That's the last time I have an EV.",@gasgas2689,7,2024-01-21T19:41:56Z
Theres a (pricey) chademo to ccs adapter.,@davidspencer7254,0,2024-01-21T19:41:36Z
"It's a very common car in Norway. Reasonable cheap to buy, and durable to the extreme. However with the many new EV's offered, it's future is behind it. Chademo charging is off course a huge disadvantage for the Leaf.",@robertdemeny251,0,2024-01-21T18:11:34Z
Please do not touch  Nissan/Renault 1.2 dig t. You will be lucky to see 50k before the engine explodes. Fact.,@stevenhearnden6103,0,2024-01-21T17:35:38Z
"Ive been driving one in the US for 2 years.  It's a great car, the chademo is a downside, newer ones in the US use ccs.  It would be nice if nissan let us retrofit ccs on chademo cars without voiding the warranty.",@vanessamonster5038,0,2024-01-21T16:17:59Z
Hyundai Ioniq does almost as many miles from a 38kwh battery. Efficiency of 4.7 miles per kwh rather than 3.,@vannicrider7953,0,2024-01-21T15:44:12Z
"As always pro’s and con’s fully explain, with real world experience, such as charge point. There is a place for all, these should be championed alongside ICE, as better is some circumstance, such as short urban journeys and where home charging allows",@russellb1212,1,2024-01-21T15:43:11Z
At this point I'd struggle to justify a Leaf compared to an MG4 or BYD Dolphin.,@deanstyles2567,0,2024-01-21T14:40:00Z
"Seems Nissan went all betamax, when the world had chose vhs.",@tomoreilly9932,2,2024-01-21T14:05:17Z
"You nailed it in regards to driving an ev in a rural area. I live in a larger rural city and we have two public plugs in town. Many people like me do a lot of miles since everything is far. Unless you have an employer that you can charge at, it’s a tough sell in rural areas.  Keep up the great variety!",@OhioPeteS2k,1,2024-01-21T13:36:18Z
"Is it me or has that been in a smash? Passenger door doesn't match front wings. 
Looks like a front end repaint.",@lordbungle6235,2,2024-01-21T13:35:39Z
"People apply politics to EV’s. At the day they are just consumer products, like shoes or a conservatory or a new suitcase. Why people get riled by them I have no idea. 
The charging, thermal runaway and human slavery issues are something that needs serious attention, but you can’t knock them for being what they are designed to do, be a car.",@TheCounty90,2,2024-01-21T13:23:37Z
If i haven't got a classic for Rustival i am bringing my 23 plate Hyundai Bayon Hybrid ( it's all ready booked in ) feel free to come and have a look over it,@leeallen1407,1,2024-01-21T12:58:32Z
I don't know about writing off the 13A plug. Say you were gòing away for the weekend. 62kWh/3.1kW is only 20 hours to leave it plugged in and get your money's worth from a rented place,@jamesbrett6518,2,2024-01-21T11:16:50Z
I think I speak for the whole market when I say I think it’s probably just about the right time to launch the Leaf Mark III.,@maxnewts,3,2024-01-21T11:15:10Z
A very thorough and interesting review. Thanks 👍,@plym1969,0,2024-01-21T11:05:52Z
Wud not touch a electric car,@johngough7614,7,2024-01-21T10:59:33Z
"The Leaf is the defacto example of a car that does have quite a bit of degradation, due to lack of proper battery management. Buying a 2nd hand Leaf requires a proper check of the battery. Especially the 30 kWh versions often have very worn out batteries because their rapid charging was actually too fast and heated up the battery too much. And about public charging: If it is done via AC, which is the most usual, the Leaf fares just as well as any other EV, be it is limited to 1-phase which is a disadvantage in some countries like the Netherlands.",@salipander6570,0,2024-01-21T10:59:31Z
Brits can build proper cars now that the unions don`t have any clout.,@kevinpotts-to5nm,3,2024-01-21T10:32:29Z
"We have a 2016 Tekna leaf which is only 24kw, it fits in with our life style perfectly. We both work from home, it's perfect for whizzing around locally for picking up and dropping off kids etc. We love it, so easy to drive and still able to shock boy racers at the traffic lights 😂. I think the type of  EV you chose is definitely proprationate to its use and your life style and the leaf ticks all those boxes for us. I should add we still have a diesel as a second car which we don't use that often but still need for towing the caravan 🙄",@martinroscoe6890,4,2024-01-21T10:24:16Z
"I test drove the Hyundai Kona and I believe it has similiar bhp, and again if you put your foot down all hell would break loose, it's too much power for the car to handle, and probably most people too.  I drove the 150bhp Leaf and it was fine, and the VW ID 3 which was 200+ bhp but rear wheel drive, it seemed a lot more refined.  The VW was like £37k and didn't even come with rear speakers as standard, it was far too basic and feature-less.  Anyways I got annoyed with the whole thing and still have a diesel car, no regrets.",@Crana,3,2024-01-21T09:58:15Z
Good review. Saw you guys yesterday in cardigan. Was rushing somewhere so didn't stop to say hello 😊,@heatherread5314,1,2024-01-21T09:54:03Z
"I could have sworn the Leaf was based on the Tilda, a model mainly aimed at developing markets.",@MajorKlanga,0,2024-01-21T09:07:13Z
"Such an ugly looking and badly thought out car. And I noticed it was getting 3.1 m/kwh, I get that out of my 3 series PHEV which is lugging round a petrol engine too! So many better electric cars on the market now, this deserves to quietly disappear.",@HiruS22,2,2024-01-21T08:54:15Z
"I was extremely tempted by one of these.

Ended up going for a plug in hybrid

Not sure if I chose right yet.",@paulsheehan2998,0,2024-01-21T08:42:01Z
"Most the older leafs only have half their range left ,and they seem deadly in a crash .",@paulb4uk,0,2024-01-21T08:37:14Z
Every honest review of EVs highlights the charging issue. Really puts me off buying one. Got to sort it out EV manufacturers!,@smoothmicra,3,2024-01-21T07:31:41Z
"I tend to agree with you about power. I don't understand the fascination with manufacturers to have ridiculous bhp on EV's. I don't need silly 400+ bhp and sub 4 second 0-60 as seems to be common place on EV's. I'd prefer to have less and have more range. The top 3 selling cars in the UK for 2023 all have less than 200bhp. So give me an EV with 200bhp, 0-60 in 7 seconds, but a range of 400 miles please.",@kennyg4744,3,2024-01-21T06:21:14Z
You can't beat a manual cable operated handbrake the Suzuki Baleno has one and that's a modern car and it's a good thing that Nissan is still making ICE cars so they will survive as a lot of Japanese vehicle manufacturers are still building ICE vehicles and may one or two EVs were as totally EV brands are struggling and the massive depreciation of an EV were one in particular ICE vehicle in Australia is appreciating the Suzuki Jimny,@lesklower7281,0,2024-01-21T05:33:49Z
"I still love my MK1 leaf and it it's used daily for the work commute of about 35 miles per day for which it's perfect for.
Mine is the 24kwh so summer range is around 90 miles and winter around 55 miles.
99% of the time mine is always charged at home overnight so it's very cheap to run.
Like Ian says a CCS adaptor is currently in development which will be great and keep the Leaf current for many more years.
I do intend to upgrade to the Gen 2 leaf maybe soon to one with the 60kwh battery for longer journeys.",@matt-beale,2,2024-01-21T05:32:31Z
"One of the best and impartial reviews on an electric car .I am not a fan of EVs but that Nissan has got a lot of things right so silly huge touch screen plenty of normal switches and dials looks like a ""normal"" car not ugly but no need for all that power and still the charging issues in the real world",@pauldavies6037,1,2024-01-21T04:54:13Z
