text,author,score,datetime
"Yeah , I got a 68 plate Tekna 40kwh in dark metallic grey which looks pretty good actually . Mine is an ex taxi which had 72k miles on the clock when I bought it 2 years ago for £12,450 . I have taken it up to 92k miles as of April 2023 and had no problems at all . It’s such an easy car to live with and with heated seats front and rear , heated steering wheel , and auto climate control , all of which can be set using the phone app so you get into a nice warm car on a winters morning 👍. I would like to think it’s worth pretty much what’s I paid after 2 years of ownership . I also charge it entirely from solar panels on my garage roof .",@antoniopalmero4063,16,2023-04-10T18:02:26Z
"I'm a 39 year old male Christian man, 6""2, bald but decent looking (I got 7-8.5 on photofeeler), well travelled, level headed, down to earth etc but I am brown skinned. This is something many will not admit to but race plays a crucial factor. White women generally are not into brown or dark skin. People prefer their own race and that's just how it is. I have to accept that sadly but this is the major reason as to why I'm single. 

It may not be too late to meet someone but I haven't even come close to being in a relationship for years now. I rarely even meet someone I want to pursue. The few I do aren't into me and the ones that are, I'm not into. There always seems to be something missing. I very rarely get a mutual match on hinge and other dating apps. Meanwhile, people around me are getting together slowly and although there are others in my situation, I am worried about being left on the shelf and being alone for the rest of my life. I don't want to continue living if that's the case. I've tried to lower my standards but that's the worst possible strategy, pretending and forcing yourself to like someone you know you're not into. 

With no one to share my life with, my existence is very lonely and empty. I have full time work but it's not fulfilling at all. I have my own home, a nice car, my health for which of course I'm grateful but I struggle to see hope in the future at this point.",@RJSyeah,0,2023-04-10T18:01:51Z
I'm looking forward to your 2033 video 'I bought a Nissan Leaf for £500'   🙂,@chrispenn715,0,2023-04-10T18:01:44Z
I would never buy a car called Leaf. But I suppose better than Flower.,@TheJustaviewman,0,2023-04-10T17:58:29Z
"Picking up my (used, 14k, 2.5 yr old) Leaf tomorrow... Eliminating the commute diesel for the (much loved and will be kept) X5 easily pays for the Leaf, which is a bit of a result :)",@LeeBlackwellUK,0,2023-04-10T17:58:14Z
"After recently reading about the Tesla owner who blew his car up with dynamite rather than pay the $22k replace the battery packs , i've decided to buy a BMW 640d  based on your previous review  - i reckon it will be cheaper to run and will put a smile on my face 😀",@davidtodd907,1,2023-04-10T17:55:47Z
"I've just changed my Leaf for a BMW i3 and the i3 is a much better car. Feels better quality and with rear wheel drive, nicer to drive. i3 is smaller but family have grown up, so fine for us.",@jimf4748,0,2023-04-10T17:55:06Z
"Pretty little car, put a 1 litre 3 cylinder petrol engine in it and it increases its appeal to many more buyers. For your average family to choose this car you need 2 cars, £40k spare and off street parking, it narrows your target audience quite a bit.",@hiramkhackenback,0,2023-04-10T17:52:11Z
Alternatively order a brand new mg4.,@sturoe7361,0,2023-04-10T17:48:19Z
Hi Matt just wondering if you've ever driven the electric mini a friend of mine has got one and it is quite surprising that the Range is only 120 miles what's your opinion on that cheers Phil from Newark,@philryan7254,0,2023-04-10T17:45:58Z
Yes the seats are rock hard! Totally unacceptable IMO.,@KimB10M,0,2023-04-10T17:43:42Z
"Oh Matt. You can't say ""nippy acceleration"" in a Japanse car! It's 2023 man! 🤣",@BURP39R,0,2023-04-10T17:42:35Z
"Kia provides a 7 year warranty on their used EV s "" from the day you drive away"", which is why Kia used EV prices have held up",@iankaye9801,0,2023-04-10T17:40:23Z
Why are evs  so boring I don't enjoy watching this content at all.,@bencartwright6734,0,2023-04-10T17:35:27Z
"Had the first gen 5 years back and currently own (PCP) the 40kw 2nd gen. Dont have any charging at home apart from 3 pin (no drive) and until recently with 4 public chargers locally have managed quite well. But now there are more and more EVs on the road. I live in a quiet but touristy seaside area & public charging is getting very busy. So for me, it will be a struggle to carry on with ownership. A big shame because it's a great car.",@chasb441,0,2023-04-10T17:28:42Z
"Another great and sincere review Thanks Matt.

I work on many brands of cars, I've driven many EV's and can say without a doubt that the Leaf is my favorite EV, Some like the Telsa are way over priced and so boring, I'm not sold on the idea of only one power source, I think we should all have a choice, EV owners seem to think that petrol and diesel should go away completely, I think that would be a massive mistake, Cars can easily live 30 years with proper maintenence, so why be forced to scrap them down the road, That's a very negative thing to do in the Tree hugging world we live in, kinda like the scrappage scheme where good cars got scrapped for no reason but a Govt pay off. 

I love how so many EV owners leave a comment about Loving not having to stop at a petrol station, yet so many on You Tube stop to charge up their EV and grab a coffee and use the toilet, These people make no sense at all, everybody has to use a toilet sometime and the love for coffee has gone through the roof, Charging an EV on the motorway is no different to stopping to fill up with petrol except it takes longer.
 
I'm sure Id hate plugging in my car every night just in case I needed to go out further a field the next day.

What I really hate is the push from EV owners to try and convince the rest of us that we need an EV, they come across so crass, with positive reviews, the act like they know it all, 
They never seem to bring up range anxiety, they used to tell us how cheap it was to charge up their cars, that seems to have died off now with today's electricity rates, and still they insist and are convinced the price of Electricity will go down, To me that defies all logic, They can install as many wind farms and Solar panels as they want but the price of Electricity will not be falling, the electricity companies will see to that.   

T.B.H. Id be happy to buy a Hydrogen car 5-10 years down the road,  that looks so positive to me and yes the infrastructure has to improve just like with EV chargers. 

Thanks for listening.",@rbnhd1144,3,2023-04-10T17:27:18Z
They will tear my RX8 out of my cold dead hands,@swompthing2626,0,2023-04-10T17:23:38Z
I love how pragmatic you are Matt! Many petrol heads would tear EVs to pieces but you give it a level headed review and say it isn't for everyone but there is definitely a market for them,@tigerroz123,55,2023-04-10T17:22:35Z
I agree the 2nd gen leaf is much of an improvement over the original one. It just looks like a normal car. It doesn't scream to people that you're a do gooder unlike other EVs,@tigerroz123,1,2023-04-10T17:19:11Z
Its the infrastructure that isn't fit for purpose Matt  - and it will get worse as more and more EV's go on the road AND they are very limited by range.  We regularly travel from N Yorkshire to Bournemouth and on the motorway network that already takes 6 hours two charging stops of 90 mins each en-route would make it a 9 hour trip and make the journey no longer a pain just simply unfeasible,@darrenwilson8042,0,2023-04-10T17:18:56Z
"My neighbour has a very early Leaf and it is perfect for her 14 miles run to the school where she teaches, and back again. She doesn't need any more range. Her husband has a hybrid Mitsubishi 4x4 for when they do longer journeys.",@timhancock6626,0,2023-04-10T17:17:22Z
"Hi Mat, crap crap crap, the range and recharging time is crazy. I would never want an EV with todays technology, the BS that goes along with the claim of them being GREENER, crap. I feel JCB with their Hydrogen engines is the only way to go, lets face it, Honda made a Hydrogen fuel car 20+ years ago and Captain Slow revealed it on Top Gear. Then of course it was shelved for decades, that would have been the right time to go hard , shouting Green....",@tonyfurneaux3399,0,2023-04-10T17:17:07Z
I'm not a luddite. I just do so few miles I'm better of buying my luxury bangers which are easy to pick up as no one wants a costly motor,@petrolhead28,0,2023-04-10T17:14:36Z
"I've had 3 Nissan leafs 24kw 30kw and the 40kw mark 2. In the end I traded in the 40kw for a Toyota Prius phv because of the endless problems I had with it. Driveshafts wearing out wheel bearing went folding mirrors failed, the media system kept crashing, all on a car with less than 30k on the clock. The 30kw needed a new rear axle. What I'd say it's a brilliant car poorly made. 8 months of Toyota ownership I've had no problems so far.",@dg115,1,2023-04-10T17:13:24Z
"I maintain that a quick battery swap mechanism is the only way EVs will dominate, the charge time and range is the limiting factor and that'd be addressed if you could pull up in the services and have your nearly-empty battery pack swapped for a fully-charged one in a few minutes. It's a way off though as manufacturers are still competing for range, once they reach the limit of physics they'll hopefully converge on a modular/universal battery format, like they did with charging ports.",@jamie_ar,0,2023-04-10T17:11:06Z
"Surely the batteries will need replacement in the next few years, and does anyone know the cost of replacement?",@davidchambers7622,0,2023-04-10T17:09:09Z
"Sorry , even if that was 10000£, I wouldn't come anywhere near it. I'd Spare some 5-10k for gas/maintenance and buy a proper, sensible city car and or weekend get away car. By the time you'd have spent your 5-10k on your petrol car, this one will loose another 10k, so your petrol car would eventually come for free😅 and if you were not sensible and bought some fun v6, perhaps you could even make some money reselling ,who knows",@makaw2006,0,2023-04-10T17:07:36Z
"The concept is good, but the practicalities aren’t. There are currently 42000ish charging points in the uk, you have to carefully research your destination point for a charging point and maybe a charging point en-route. Plus if anything goes seriously wrong with one of these vehicles it is going to cost a fortune. The infrastructure is just not there, there are over 7,000,000 terraced house’s in this country, goodness knows how many people live in flats",@robertheywood5523,0,2023-04-10T17:06:45Z
I do not like this overpriced Nissan Leaf EV car as I prefer ICE cars.,@zitzong,0,2023-04-10T17:06:24Z
"I couldn't agree more about the styling of many EV's, so many of them look like they fell from a fairground ride. For me, I want to hear the engine when I put my foot down, not like a washing machine on spin cycle.",@peegee9931,1,2023-04-10T17:04:18Z
"its a shame you cant get these with an even bigger battery for a longer range. im currently driving for dominos, but you can cover close to 200 miles in a shift if youre working something like a 5pm-3/4am. there isnt enough dead time in the shift to give the car a quick top up. if they could offer 300 miles, then they would be more appealing to some people in these job in the uk (where it seems they buy fiat puntos from scrap yards as staff cars that are always breaking). if they had more range, once they've depreciated after a few years they would be appealing option, even for uber eats and deliveroo and just eat drivers. but for now, most people are sticking to small diesel cars that return around 50-70mpg. or the most likely 'idiots' like me who got rid of their mk8 fiesta after it needed quite a bit of money spending on it and bought a 2017 bmw 220d with 15k miles and is putting 2.5k miles a month on it. gets me about 52mpg at work though so i make a little bit off the fuel pay, and im always comfy when at work, whether it's sunroof weather or heated seats weather. surprisingly the insurance was very cheap too at 18 with 1 year ncb",@sammilburn445,0,2023-04-10T17:02:35Z
"Think a lot of people do short journeys now, so cars like this will become more common. So if you had a round trip to work of 20 miles and the odd trip to supermarkets etc, then one nights charge at home would keep you going for a week.",@tomoreilly9932,1,2023-04-10T16:59:48Z
They make them look funny because they don't want to sell to many because they can't supply enough if it's too good,@BobbyDeniroX,0,2023-04-10T16:58:23Z
"What do you drive?  A leaf, FFS.  Almost as bad as a Renault Wind or Zoe.  Gone are the names of GSi, SRi, ST, RS etc…. More excitement with my washing machine model name than this bag of 💩.  😂",@angrynortherner3805,1,2023-04-10T16:53:20Z
"A great feature of the leaf is the flow through ventilation system so if it is 18° C for example outside you just opened the vents and fresh blows through, an important feature for an electric vehicle, imho.",@iankaye9801,0,2023-04-10T16:52:06Z
"Have to confess, as a general rule despise and mock EV but this doesn’t seem half bad on all fronts. For local commuting, ticks the boxes. 
2 cup holders swings it 👍😀",@ktclm0617,0,2023-04-10T16:48:40Z
"All I'm saying is, if you buy a car called ""Leaf"", and it starts to shake a lot, you'll have no real comeback.",@allanforsyth1719,0,2023-04-10T16:45:26Z
This confirms my in-built prejudice. I ain’t turning over a new leaf! I’ll stick with go juice for as long as I can 😂,@nigelbond4056,0,2023-04-10T16:44:27Z
I think I'll just stick with my petrol car for now.,@mrlover4310,0,2023-04-10T16:43:11Z
"Hi Matt, great review (as usual).
Question: does that £25k purchase the batteries as well as the car?
When I looked at second hand gen 1 Leafs a few years ago some involved leasing the batteries.",@jaidank,0,2023-04-10T16:41:47Z
"it might be free road tax for now, but it wont be long before its not free, and we're all taking bets on the tax level that they will be incurring.",@crazyfroggie6546,0,2023-04-10T16:41:22Z
I work for a shipping company and we shipped 30 of these to SRI Lanka  a few years ago . We had a great time doing fast starts up the ramp into the container . Then we closed the doors said good bye never to be seen again . They will probably be being pulled around by Elephants soon  Best place for  em,@roysimpson9711,0,2023-04-10T16:36:02Z
"How are people that live in a flat or with no driveway at home expected to live with an EV? Not for me thanks ICE all the way? Zero car tax, for the moment!!",@davemorris9275,0,2023-04-10T16:30:53Z
Is the plural of this car Leafs or Leaves?,@posiub,0,2023-04-10T16:30:39Z
Something about the Nissan Leaf which is abit tragic.,@interceptor-ss8kb,0,2023-04-10T16:30:32Z
Hi Matt i wanted to ask you why do you like cheap budget cars?,@lochansivanandancars892,0,2023-04-10T16:28:05Z
"I can't pretend they are a good car, but an 8 year old one is worth nothing taking into account battery life. Add to that range and charging issues, and you can count me out",@watchalot919,0,2023-04-10T16:25:59Z
Only driven a car once with one pedal driving and it took two minutes to get used to. Very useful. The biggest problem in U.K. is not the range but the infrastructure. Electric is the future but we have a long way to go to catch up Norway.There were electric taxis in London in 1897 so it is not a new thing. Henry Ford in the 1920s sold only electric cars to women drivers as the complexity of driving a petrol car in those days was considered to be beyond the capabilities of women! Wouldn’t be considered very pc these days!,@christophernoble6810,0,2023-04-10T16:24:35Z
"I remember when Nissan announced the new pulsar & thought it was gonna be a hot hatch gti-r type of thing.
 It wasn't",@madanto2394,0,2023-04-10T16:22:56Z
"As electric cars go I find the current Leaf quite agreeable. It looks clean and sharp enough. I just find it difficult to pluck up enthusiam for any electric car. That said, the Honda E is cool. Would consider that as a second car.",@jdmguy44,1,2023-04-10T16:21:13Z
8:29 from the year 2025 road tax will no longer be free for electric vehicles. Owners of these vehicles will have pay their way like the rest of us,@curtisj2165,0,2023-04-10T16:19:06Z
"Hi Matt, I test-drove a Jaguar i-pace the other day, it was a 2018 plate with 39,000 miles on the clock. I loved the car but then I did a little more research work. I discovered that the car had depreciated over half of its list price in less than five years ( approx £29,000 ) more than a similarly priced petrol/diesel equivalent. The battery is only covered for 8 years of manufacturer warranty !!!!!! so in three years if the battery died I would have to pay approximately £8000 - £ 10000 for a new one. The tax incentives that the government initially gave to get everybody into an EV are slowly being taken away and are now saying that from 2025 all-electric cars will have to pay VED at the standard road tax rate furthermore the little government help to have home wall chargers installed is no longer available. With the current price of electricity/availability of suitable charging stations at present, I think I will stick to my trusty 3-year-old diesel car.",@stevie007,65,2023-04-10T16:18:41Z
"My dad has one of these and it’s a joy to drive, as you said effortless, when you master the e pedal it’s great",@davidbriggs4323,0,2023-04-10T16:16:44Z
"Thanks Matt. About time you did a review of a BEV. Would love to see you review a used Tesla, taking into account the ease of use of the Tesla supercharger network. I love my Model X, and even tow my caravan with it all over the country",@yerags,3,2023-04-10T16:11:49Z
"I know someone who bought a 2nd hand Leaf just before Christmas. He says it's very good, it's all he needs.",@andysalter4473,0,2023-04-10T16:10:36Z
"I think EV’s are just another thing the government are trying to push us into just like when they told us diesel was the way to go. Now they tell us that diesel / petrol is bad and we should be driving EV’s. Then in a few years they will tell us that the earth can’t supply any more materials to make the batteries and the hydrogen fuel cell is the way to go. I honestly believe the hydrogen fuel cell will be the vehicle fuel of the future, it just needs the time to refine it and get the price and infrastructure at a point where it’s viable. I’ll stick to my Honda Civic 1.8 petrol for the foreseeable future, I really don’t have a concern about what they say about emissions damaging the planet when there’s thousands of aircraft in the air dumping  ton’s of crap into the atmosphere.",@DARTraderMediaProductions,0,2023-04-10T16:09:56Z
First leaf had issue with poor battery design. especially one with creamy seats. after 2013 battery was much better,@wolverine1981pl,0,2023-04-10T16:07:53Z
"Sorry Matt, 40k for one of them nee hope, would make a car for a learner though and that’s it .",@robertwalker1742,0,2023-04-10T16:07:52Z
Cmon Matt why not do a car that you could get for 40K and i’m sure it will be more interesting than a box ticking exercise,@raymondrose10,0,2023-04-10T16:07:09Z
Several families have EVs around me along with a petrol or diesel car.  The EVs are used to go to work on weekdays but come weekends or holidays which car do they use?  Yep NEVER the EV.  Says it all.,@MrH250,0,2023-04-10T16:06:02Z
"We've had an EV with 60-80 Miles range for 4.5 years, doing 12k Miles a year. It's our 2nd car but does 95% of our journeys. Honestly it's fine if you have home charging.",@AndrewEbling,3,2023-04-10T16:06:01Z
"Another down to earth honest review. As you say, its a great little runabout or just for a short commute",@robinjones6999,5,2023-04-10T16:05:40Z
"We are all going to have to get convinced before too long I guess, but right now I wouldn’t buy an EV there is a way to go with the tech I think. 
I do live in Germany but in my city you would get laughed at for first driving a Nissan and an EV
Later this year I’ve hired a Fiat 500 for 2 weeks holiday in Corsica, let’s see how that goes",@gollyboys1,0,2023-04-10T15:59:57Z
